Bangalore Scottish School,963,362,52.237316533333,-0.8862105,School,High School,School
Bangalore International School,120,597,13.0474,77.6466,School,High School
Bangalore International Public School,19,1001,12.90964,77.55014,School,School,Education
The Bangalore School,192,23743,12.9702722,77.7412044,Education,Education,Education
Bangalore Adventure School,11,1967,12.84084,77.67175,Travel/Leisure,Outdoor Recreation,Sports Instruction,Tour Company
Bangalore Military School,161,94,12.9624,77.6085,Local Business,School
The International School Bangalore,5115,3132,12.891834153315,77.750649641874,School,High School,School
Bangalore School of Speech and Drama,20,2055,12.9833,77.5833,Education,Education,Education
Amity Global Business School (Bangalore),393,971,12.9404802,77.6202774,Education,School,Education
The Bangalore School of Music,381,2296,13.02661733,77.591627856,Non-Profit Organization,Orchestra,Performance Venue,Music Lessons & Instruction
Bangalore School for Performing Arts,48,1638,12.92724,77.66952,School,School
Delhi Public School Bangalore East,120,764,13.0110798,77.7429123,Education,High School,Education
"Amrita School of Engineering, Bangalore.",7292,4236,12.897696331429,77.67598748,University,Technical Institute
Legacy School Bangalore,59,752,13.05713017,77.65185398,Education,Education,Education
Canadian International School Bangalore,248,291,13.1002197,77.5942993,Organization,Education,Organization
"Cathedral High School, Bangalore",387,984,12.9667,77.6078,Landmark,High School
ABBS-Acharya Bangalore B School,4056,13662,12.991453666667,77.4832849,Education,Education,Education
SSM School Bangalore,63,581,12.93934428,77.60565006,School,School,School
Bangalore School of Civil Services,178,1962,13.037641386029,77.589493989944,Education,Educational Organization,Education
The Music School Bangalore,14,599,12.96227,77.59564,Education,Education,Education
Ebenezer International School Bangalore,881,10560,12.839828682,77.707492084,Education,School,Education
Delhi Public School Bangalore North,1246,1464,13.118663328333,77.64130297,School,High School,School
Bangalore Horse Riding School,79,834,13.05833818,77.58586448,School,School,School
"National School of Journalism, Bangalore",101,455,13.10117,77.59866,Media/News/Publishing,Broadcasting & Media Production,Technical Institute
Iame B School Bangalore,243,2483,12.8199129,77.50611895,Education,School,Education
"LISAA School of Design, Bangalore",1164,58920,12.932318344855,77.612182026672,Education,Educational Organization,Art School,Fashion Designer
"Global Indian International School (GIIS), Whitefield, Bangalore",394,1822,12.924795,77.633825,Education,Education,Education
Ekya Schools,251,8939,12.9593399,77.69242,School,School,School
Bangalore science forum summer school,1,98,12.94824,77.5744,School,School,School
Philharmonic School of Music Bangalore,3,391,12.987571057811,77.591051065941,School,School,Arts & Entertainment,School
Royal School Bangalore.,12,495,12.90667,77.57244,Education,High School,Education
Candor International School (Bangalore),446,25899,12.819833802,77.62086425,Education,Education,High School
"St. Norbert School, Bangalore",3,173,13.07327,77.66732,School,School,High School,Middle School
Orchids The International School - Bangalore,296,5692,13.04921,77.55161,School,School,School
"KLE Society's School, Rajajinagar, Bangalore",897,2232,12.99605,77.55371,School,Educational Organization,High School,School
"Nurture International School, Bangalore",37,454,13.0583,77.5070267,Education,High School,Education
"Premier High School, Bangalore",167,612,12.987881040148,77.564927784235,Education,Educational Organization,High School,Education
Bishop Cotton Boys' School,7527,8665,12.96861111,77.59877778,School,Junior High School,School
ISBR Business School,1411,22326,12.843524005556,77.664567874444,Education,School,Education
"IFIM B School, Bangalore",3930,13273,12.849633233472,77.66303873475,Education,College & University,Education
School Dabba,0,614,12.97585,77.641,Local Business,Food & Beverage Service & Distribution
The Frank Anthony Public School - Bangalore,915,2002,12.97026114,77.62764878,School,High School,School
"Canara Bank School of Management Studies, Bangalore University",739,786,12.94303,77.50454,Education,Education,School
"Happy Hours  Pre-School, Bangalore",24,611,12.9704599,77.63755,Organization,Organization
SchoolPage,13,23896,12.999,77.66339,Education,Education
"Holy Angels High School ,Bangalore",121,1181,12.957,77.52954,Education,High School,Education
"Shri Ram Global School, Bangalore",23,220,12.95705,77.78209,School,School,High School
Canadian International School (Bangalore),6,26,13.1204,77.5937,Local Business,School,Organization
Bangalore Higher Secondery School Old students forrum.,1,208,12.95644,77.5674499,School,High School,School
Geetanjali Olympiad Schools Bangalore,81,1263,12.9833,77.5833,School,Educational Organization,School
Bangalore International School Round Square 2015,61,534,13.0474364625,77.64661752,School,High School,School
"Maple Bear Canadian Pre-School, Gottigere, Bangalore",244,536,12.858749863185,77.596271162796,School,Child Care,Day Care,Preschool
"Dhee Global School, Bangalore",16,610,13.03205,77.621795,School,High School,School
National Children School - Bangalore,14,297,12.9807,77.6160699,School,School,School
Bethesda International School Bangalore,338,345,12.9947698,77.50670432,School,School,High School
Mahindra Pride School Bangalore,51,137,13.02682,77.54383,Non-Profit Organization,Automotive
Acharya's Bangalore B-School,3702,1355,13.003352151354,77.485391199812,Education,School,Education
RBBPAM High School Bangalore,7,187,13.00046,77.61376,School,School,High School
Capstone Community School,102,420,13.05149,77.6421,School,School
"Delhi Public School whitefield,l Bangalore",322,364,13.0129511,77.7820023,School,High School,School
The Art School - Bangalore,12,132,12.92938,77.5847,Arts/Entertainment/Nightlife,Art School
ST.Martin's High School,421,1341,12.97321,77.56647,School,High School,School
"Goodwill's Girls School, Bangalore",96,73,12.9959,77.6091,Landmark,High School
"Logic School of Management, Bangalore",0,146,12.97098,77.6456199,Education,Education,Education
"Deva Matha Central School - Vidyaranyapura, Bangalore",91,476,13.076,77.558,Education,High School,Education
"School Of Management Studies, Bangalore University",44,172,12.97549,77.5828,University,College & University
Chinmaya Vidyalaya School Bangalore,65,264,12.9840486,77.6152539,Education,Education,High School
Delhi Public School bangalore north,83,1281,12.9833,77.5833,Organization,Organization,School
"IIS India International School , Bangalore",0,313,13.70929,100.57095,Education,Education,Education
"Zee School, South Bangalore",1,66,12.9334399,77.6378,School,School,High School
"St. Norbert International School, Bangalore",0,337,12.9833,77.5833,Education,High School,Education
Kids' choice Play School Bangalore,6,225,13.0620003,77.6510315,School,School,School
"St. Paul's English School, Bangalore",105,198,12.9148,77.5963,Local Business,High School
Okinawan Karate School Bangalore,2,875,12.95449,77.55584,Education,Martial Arts,Education,Education
Bangalore Higher Secondary School,99,814,12.948075,77.58003,School,High School,School
"Immanuel High School ,nagavara Bangalore",8,186,13.03338,77.61928,Education,Education,High School
Global Residential Schools Bangalore,65,451,13.01623,77.76486,Education,Educational Service,Education
"IFIM B School, Bangalore IFIM B School, Bangalore Admissions",5,809,12.85523,77.66706,Education,Education
Natyanjali Bangalore / Natyanjali School of Dance/ Natyanjali Trust,5,52,12.89919,77.58588,School,School,School
Christ school bangalore,2081,1921,12.9308099,77.60334,School,High School,School
"Vidyanikethan English School, Avalahalli, Bangalore.",88,492,13.03778,77.73839,School,Educational Organization,School
School of India,15,8277,12.813182260861,77.58261680603,School,School,Education
"Narayana IIT Olympiad School, HSR Layout Bangalore",41,353,12.91251,77.66575,School,School,Education
St vincent pallotti school bangalore- Alumni,42,717,13.02283,77.64843,Local Business,Junior High School,School
Schoolexpertz,0,5118,12.92603,77.58604,Education,Education,Education
SchoolEngg,1,2080,12.90629,77.54658,Education,Education
"JES Public School - Twinklers School , Bangalore",35,514,12.9502096,77.5024719,Education,School,Education
Holy Mariam Convent High School Bangalore,10,153,12.9833,77.5833,Education,Education,High School
"Little Flower Public School, Bangalore - 560085",15,1008,12.91671,77.6042,School,School,School
"Army School Bangalore, Batch of (1998-2001)",54,69,12.98448,77.6118,Education,Education,High School
St.John's High School (Bangalore) Alumni Association,181,1844,12.99064,77.61377,School,School,School
WeSchool Bangalore |Helpline|,143,645,12.842913347836,77.663019124349,Education,Educational Organization,Education
"Indian Academy School of Management Studies, Bangalore",134,754,13.03594,77.64002,University,College & University
"St Germain High School and P.U. college,Bangalore",55,401,13.008340315536,77.600502432636,School,High School,School
"Emmanuel Sugnana Jyothi High School, Kammanahalli Bangalore",143,397,13.0149,77.63285,School,School,High School
Good hope english high school chinnapa  garden  bangalore,1,70,13.00497,77.6031,School,School,School
Little Orkids Pre School Bangalore,1,32,12.976519674704,77.595224372373,Education,Education,Education
"St Pauls English High School , Bangalore",81,2106,12.91463,77.59695,Education,High School,Education
Bangalore Chapter Ohara School of Ikebana,2,253,12.994395,77.757705,Non-Profit Organization,Education
"London School of Commerce, Bangalore",616,10937,12.9833,77.5833,Education,Education,Technical Institute
Vidyaniketan Public School,330,81,12.966666666667,77.566666666667,City,City,High School
"C f andrews school, bangalore",18,18,13.01063,77.6142,Education,High School,Education
"International School of Business & Media, Bangalore",1,193,13.23014,77.25037,Education,College & University,Education
Greenfield Public School,6,1713,13.09669,77.61869,Education,Education
Millennium School of Business - MBA BCom BBA College Bangalore India - MSOB,12,4552,12.94465,77.597,Education,College & University,Education
"St. Antony's Primary School, R M Nagar, Bangalore",77,1397,13.01327,77.66219,Education,Education,Education
Bangalore Horse Riding School,27,21,13.06982756,77.61219026,Sports/Recreation/Activities,Sports Club,Horses,Outdoor Recreation
Our Lady of Bon Secours Girls High School Bangalore,13,631,12.99668,77.62209,School,School,School
Nathaniel School Of Music,341,41770,12.95783,77.60361,Education,Musician/Band,Music Lessons & Instruction,Music Production
"Indiranagar High School, Indiranagar, Bangalore",61,1401,12.972485,77.6339806,School,High School,School
"S.S.R School of Management Studies, Bangalore",365,590,12.9833,77.5833,Education,Education,Education
"Sophia High School, Bangalore",5577,1167,12.986472046891,77.58740080645,Local Business,Public School,High School
"Laxminarayan School of Music and Meditation - Bangalore, India",3,830,12.9833,77.5833,School,School,School
"Patanjali school of Ashtanga Yoga & Research. Whitefield, Bangalore",1,67,12.97123,77.7493,Health/Beauty,Yoga & Pilates,Professional Service
"Seventh Day Adventist School, Jalahalli, Bangalore - 560015",12,403,13.0544596,77.538063,Education,Education,Education
Nurture International Pre-school - South Bangalore,3,184,12.88598,77.58555,School,School,Day Care
Vidhya Jyothi School B T M Layout Bangalore,8,624,12.91231,77.61592,Education,Education,Education
"St. Ann's High School, Rajajinagar,Bangalore",139,1329,12.98601076,77.547635,School,School,High School
Radcliffe School,629,166,12.8578312,77.5915121,Education,School,Education
London School of Commerce - Bangalore Campus,41,2026,13.04697459,77.57862394,Education,Education,Technical Institute
Sri Morarji Desai Model Residential School Chamaraj pet Bangalore,2,199,12.9833,77.5833,Education,Education,Education
"School of Engineering and Technology, Jain University",7794,8609,12.641440179673,77.440639208157,Education,Technical Institute,Education
Unit school station workshop E.M.E bangalore,50,296,12.958366245789,77.66575189395,School,School,School
Angels Convent English School/Angels High School,7,184,13.00522,77.5527199,School,School,High School
K.S. School of Engineering and Management,1678,1815,12.9293071,77.55217575,Education,Technical Institute,Educational Service,Education
"St. Teresa's Girl's High School Chamarajapet, Bangalore",130,2720,12.96043,77.56845,School,School,School
The School of Photography,0,761,12.9201603,77.5875397,Education,Art School,Photographer,Photographic Services & Equipment
"Indian high school,Basaveshwarnagar,bengaluru-560079",13,719,12.9869299,77.5398788,School,School,School
Sambhram School of Bussiness - S2B Bangalore,19,18,13.0917438,77.5469402,Education,Education,Education
"Rishi Valley School, Bangalore",0,30,13.634,78.454,School,High School,Landmark,School
Cecilia English High School,0,39,13.0040554,77.6361843,School,School,High School,Preschool
Sacred Heart Boys High School - Bangalore,153,364,12.96677,77.60925,School,High School,School
Bangalore Premier Soccer School - BPSS,0,197,12.99868,77.6294999,Sports/Recreation/Activities,Sports & Recreation
KLAY Prep Schools and Day Care,559,11040,13.00906,77.59709,Education,Education,Education
"SRI HARSHA SCHOOL, Bangalore",67,140,12.89615,77.56639,Education,Education,High School
B.M.S. School of Architecture,592,869,12.97339685,77.53532298,Education,Education,Technical Institute
Japanese Language School,56,1221,13.001702869551,77.599267640817,Education,Education,Education
The Bangalore School of Ikenobo Ikebana,0,126,12.9806,77.63661,Attractions/Things to Do,Arts & Entertainment,Art School,Florist
The Valley School,5092,778,12.8535,77.51,School,High School,School
"La Wisdom School, Bangalore, by IITians, inspired by J.Krishnamurti",40,1202,12.9332535256,77.629652023315,Education,Educational Consultant,Educational Research,Education
Greenwood High International School,1250,117551,13.042685246232,77.76202095108,School,High School,School
"Narayana E-techno school, bangalore",407,604,13.0752239,77.5623483,School,School,School
Harvest International School,813,2525,30.792367454225,75.595943812274,School,High School,School
The Cambridge International School,6,175,12.9208,77.66484,Education,High School,Education
Treamis World School,878,5218,12.816902528287,77.651476586625,School,School,High School,Elementary School
Delhi public school Bangalore east,1167,105,12.884158781931,77.724863437043,Local Business,Public School,High School
Cathedral Composite Pre-university College & High School,4358,2954,12.966344495168,77.607083892036,School,High School,College & University,School
Inspiro IAS Coaching Schools,238,3005,12.9673901,77.53405,Education,Education,Education
Krupanidhi School of Management,1852,713,12.915169044,77.723292348,University,College & University
"Little Flower Public School, Bangalore",0,14,12.9317,77.5414,Landmark,High School,Landmark
Delhi Public School Bangalore North Sports Day,79,2231,12.9833,77.5833,Sports Event,Sports & Recreation
Kannada Language Learning School,49,3623,12.9357004,77.6283875,Education,Language School,High School,Education
Riders Driving School Bangalore,9,629,12.93462,77.56919,Business Service,Driving School,Business Service
"Hello KIDS PLAY School, Bangalore",45,591,13.01194341,77.69664171,School,School,School
School jokes,18,10693,13.0004274,77.6069088,School,School,School
IZee Business School,255,23523,12.8680201,77.6511412,Education,College & University,Education
"IISc 4th Undergraduate Summer School on Computer Science, 2016",27,1998,13.01744,77.56797,Education,Education,Education
The Little School,66,301,12.9803896,77.637207,School,Day Care,School,High School
"St.Philomenas English School,SARJAPUR",18,90,12.87206,77.78705,School,School,School
Whitefield Global School,679,1222,12.98154334,77.7572358075,School,Junior High School,Elementary School,Middle School
Isaac Newton English School,19,607,12.96885,77.56971,School,Day Care,High School,Middle School
Blossoms School,9,225,12.95809,77.7204299,School,School,School
Nitte International School,82,931,13.09899,77.57545,Education,High School,Education
ICFAI Business school. Bangalore,10,41,12.93512,77.69035,Organization,Organization
Nitte School of Management,2990,2050,13.127920861429,77.587935052857,Education,Technical Institute,Education
Baldwin Boys' High School,1281,2481,12.9628,77.6059,Local Business,High School,School
"St. Paul's English School, Bangalore",7,365,12.9148902154,77.5970402996,School,School,School
"School of Law, Christ University",2142,2180,12.93475833,77.60600556,University,College & University
Indus International School Bangalore,2825,298,12.83453,77.77887,Local Business,High School
Jain International Residential School. Bangalore,2321,352,12.639857983471,77.44317997449,Local Business,Organization,High School,Arts & Entertainment
Global School of Media Arts & Communication,0,231,13.06434,77.64854,Education,Education
Canadian International School,826,2235,13.115467166423,77.606863975525,School,School,School
Pearson Schools India,268,12566,12.9833,77.5833,Education,Education,Education
Indus International School Bangalore,73,22,12.8858599,77.7444,Education,Education
BGS School Of Architecture & Planning,1622,3110,12.84968274181,77.463034456668,Education,Educational Organization,Architect,Technical Institute
Design School,0,118,13.02447,77.5958799,Education,Education
National School of Business,40,1677,12.9143899,77.58707,Education,College & University,Education
V School,30,968,13.01015,77.5823135,School,High School,Preschool,School
Dream Zone School of Creative Studies- Sadashivanagar,46,4083,13.028020184251,77.554880899353,Education,Educational Service,Education
Orchids The International School- BTM Layout,62,892,12.9000299,77.5983,Education,Education,Education
The Montessori School,39,315,12.90514289,77.58463122,Education,Organization,Education,Education
"Symbiosis School of Media & Communication, Bengaluru",3081,5109,12.8413080425,77.66853948375,Education,College & University,Education
Kidoz School,33,928,12.92869,77.566803,School,Elementary School,School
Royal Concorde International School,196,1852,13.01822,77.64251,School,School
Mallya Aditi International School,2562,1403,13.1022222222,77.5830555556,School,High School
Chitrakoota School,90,669,12.94155,77.46731,School,Elementary School,Educational Organization,School
Alpine Public School,303,2902,12.89380542,77.562739295,School,High School,School
Inspiro School of Civil Services,247,806,12.9673901,77.53405,Education,Education,Education
SamSidh Group Of Schools,48,6326,12.890885,77.637946,Education,School,Education
Orchids The International School- Nagarbhavi,35,1058,12.95814,77.51876,Education,Education,Education
Daffodils English School,198,1179,13.0348254,77.5790804,School,School,School
Natyalaya School of Dance and Music,38,983,12.9074202,77.5923462,School,School,School,Dance Instruction
Drishti School of Photography,647,1651,13.048872785831,77.603995924759,School,Photographic Services & Equipment,Art School,School
Srishti School of Art Design and Technology,2653,4985,13.1017,77.5836,University,Technical Institute
"National Public School, Indiranagar",356,433,12.96958333,77.64677778,Landmark,High School,School
RVM School Of Inspiration,5,3180,12.9833,77.5833,Non-Profit Organization,Non-Profit Organization
Seventh Day Adventist High School(1982-87),788,1366,12.99531,77.61139,Local Business,High School
Bangalore International School,0,0,13.01537,77.6289,Local Business,Local Business
Akash International School,868,575,12.9833,77.5833,School,Junior High School,School
Jubilee School,354,1164,13.017582360711,77.503681358737,Education,Educational Organization,High School,School
Bishop Cotton Girls' School,4895,6545,12.9704,77.6014,Local Business,High School,School
Oasis International School,226,1475,13.06411,77.71818,School,School,School
IBMR Business School,696,630,12.947410063646,77.599491611777,Education,Education,Education
Innisfree House School,104,484,12.91096389,77.58723611,Landmark,School,Landmark
"ST JOHNS HIGH SCHOOL,Papareddy Palya",48,454,12.9742298,77.6237335,School,School,High School
St. Germain High School,1040,851,12.9936,77.6105,Local Business,High School,School
"National Law School Of India University, Bangalore",984,105,12.95536196202,77.517736270017,Local Business,Educational Organization,Technical Institute
BMSB 13th Batch - Baroda Manipal School of Banking 2014-15,35,804,12.873485226793,77.642476785057,Bank/Financial Institution,Educational Organization,Commercial Bank,Bank/Financial Institution
"Arthakul |Finance Club, WeSchool Bangalore|",0,359,12.89685,77.60029,Education,Education,Education
"Cambridge School, K.R Puram",409,939,12.9833,77.5833,School,High School,School
"National Public School, Koramangala",1592,371,12.9492,77.6208,School,High School
Orchids The International School- Mysore Road,36,1080,12.94329,77.52612,Education,Education,Education
Jain Heritage School,131,1719,13.04778,77.60107,School,School,School
Prasiddhi School,32,424,12.99703,77.58726,School,School,School
